{
  "id": "alienvault-otx",
  "name": "AlienVault Open Threat Exchange",
  "url": "https://otx.alienvault.com/api",
  "description": "Crowd-sourced threat intelligence sharing platform with real-time threat data",
  "category": "vulnerability",
  "sub_category": "threat-intelligence",
  "format": "json",
  "tags": ["threat-intel", "community", "security"],
  "quality_score": 85,
  "user_weighted_score": 85,
  "freshness": 90,
  "authority": 80,
  "coverage": 85,
  "availability": 90,
  "last_updated": "2025-04-22T00:00:00Z"
}