{
  "id": "cisa-kev",
  "name": "CISA Known Exploited Vulnerabilities Catalog",
  "url": "https://www.cisa.gov/known-exploited-vulnerabilities-catalog",
  "description": "CISA's authoritative source of vulnerabilities that have been actively exploited in the wild",
  "category": "vulnerability",
  "sub_category": "exploited",
  "format": "json",
  "tags": ["official", "government", "exploited", "security"],
  "quality_score": 95,
  "user_weighted_score": 95,
  "freshness": 85,
  "authority": 100,
  "coverage": 90,
  "availability": 95,
  "last_updated": "2025-04-22T00:00:00Z"
}