{
  "id": "sans-isc",
  "name": "SANS Internet Storm Center",
  "url": "https://isc.sans.edu/api/",
  "description": "Cooperative cybersecurity monitoring system with daily reports on emerging threats and vulnerabilities",
  "category": "vulnerability",
  "sub_category": "threat-intelligence",
  "format": "json",
  "tags": ["threat-intel", "monitoring", "security"],
  "quality_score": 85,
  "user_weighted_score": 80,
  "freshness": 95,
  "authority": 90,
  "coverage": 75,
  "availability": 95,
  "last_updated": "2025-04-22T00:00:00Z"
}