{
  "id": "cert-vn",
  "name": "CERT Coordination Center Vulnerability Notes",
  "url": "https://www.kb.cert.org/vuls/",
  "description": "Technical documents describing vulnerabilities, their impact, and mitigations from Carnegie Mellon University's CERT/CC",
  "category": "vulnerability",
  "sub_category": "advisory",
  "format": "json",
  "tags": ["advisory", "academic", "security"],
  "quality_score": 85,
  "user_weighted_score": 80,
  "freshness": 75,
  "authority": 90,
  "coverage": 75,
  "availability": 95,
  "last_updated": "2025-04-22T00:00:00Z"
}