{
  "id": "zero-day-initiative",
  "name": "Zero Day Initiative",
  "url": "https://www.zerodayinitiative.com/advisories/published/",
  "description": "Vulnerability acquisition program that procures zero-day vulnerabilities from security researchers",
  "category": "vulnerability",
  "sub_category": "advisory",
  "format": "rss",
  "tags": ["zero-day", "advisory", "security"],
  "quality_score": 90,
  "user_weighted_score": 90,
  "freshness": 85,
  "authority": 95,
  "coverage": 80,
  "availability": 95,
  "last_updated": "2025-04-22T00:00:00Z"
}