{
  "id": "mitre-cve",
  "name": "MITRE Common Vulnerabilities and Exposures",
  "url": "https://cve.mitre.org/data/downloads/",
  "description": "Official CVE dictionary and standard identification method for publicly known cybersecurity vulnerabilities",
  "category": "vulnerability",
  "sub_category": "cve",
  "format": "xml",
  "tags": ["official", "standard", "security"],
  "quality_score": 95,
  "user_weighted_score": 90,
  "freshness": 85,
  "authority": 100,
  "coverage": 95,
  "availability": 95,
  "last_updated": "2025-04-22T00:00:00Z"
}