{
  "id": "vuldb",
  "name": "VulDB Vulnerability Database",
  "url": "https://vuldb.com/",
  "description": "Independent and comprehensive vulnerability database documenting, explaining and rating vulnerabilities",
  "category": "vulnerability",
  "sub_category": "database",
  "format": "json",
  "tags": ["database", "commercial", "security"],
  "quality_score": 80,
  "user_weighted_score": 75,
  "freshness": 90,
  "authority": 75,
  "coverage": 85,
  "availability": 90,
  "last_updated": "2025-04-22T00:00:00Z"
}