{
  "id": "nvd-cve",
  "name": "National Vulnerability Database",
  "url": "https://nvd.nist.gov/feeds/json/cve/1.1/nvdcve-1.1-recent.json.gz",
  "description": "NIST National Vulnerability Database CVE feed",
  "category": "vulnerability",
  "sub_category": "cve",
  "format": "json",
  "tags": ["official", "government", "security"],
  "quality_score": 95,
  "user_weighted_score": 95,
  "last_updated": "2025-04-22T00:00:00Z"
}