{
  "id": "vendor-advisory-cve",
  "name": "Vendor Security Advisories",
  "url": "https://example.com/vendor-advisories",
  "description": "Collection of security advisories from major vendors",
  "category": "vulnerability",
  "sub_category": "cve",
  "format": "rss",
  "tags": ["vendor", "advisory", "security"],
  "quality_score": 85,
  "user_weighted_score": 80,
  "last_updated": "2025-04-20T00:00:00Z"
}