{
  "id": "exploit-db",
  "name": "Exploit Database",
  "url": "https://www.exploit-db.com/search?type=json",
  "description": "Archive of publicly disclosed security vulnerabilities and exploits",
  "category": "vulnerability",
  "sub_category": "exploit",
  "format": "json",
  "tags": ["exploit", "proof-of-concept", "security"],
  "quality_score": 90,
  "user_weighted_score": 85,
  "last_updated": "2025-04-21T00:00:00Z"
}